{
  "$schema": "../schemas/application-module-registry.schema.json",
  "$schema_note": "Website Director V2.15 provider-neutral application module registry. Modules are opt-in and must be justified by behavior; this file does not activate every module.",
  "framework_version": "2.15.0",
  "provider_policy": "PROVIDER_NEUTRAL",
  "modules": [
    {
      "module_id": "AUTHENTICATION",
      "required": false,
      "status": "NOT_REQUIRED",
      "business_reason": "Account identity and sign-in only when user stories require it.",
      "data_classes": ["identity", "credentials"],
      "security_risk": "HIGH",
      "external_provider": null,
      "owner": "application",
      "dependencies": ["API", "DATABASE"],
      "verification_required": true,
      "exception": {"applied": false, "reason": null}
    },
    {
      "module_id": "AUTHORIZATION",
      "required": false,
      "status": "NOT_REQUIRED",
      "business_reason": "Server-side roles and object access only when protected behavior requires it.",
      "data_classes": ["identity", "authorization"],
      "security_risk": "HIGH",
      "external_provider": null,
      "owner": "application",
      "dependencies": ["AUTHENTICATION", "API"],
      "verification_required": true,
      "exception": {"applied": false, "reason": null}
    },
    {
      "module_id": "USER_PROFILE",
      "required": false,
      "status": "NOT_REQUIRED",
      "business_reason": "User-owned profile data only when a story needs durable preferences or identity details.",
      "data_classes": ["personal_data"],
      "security_risk": "HIGH",
      "external_provider": null,
      "owner": "application",
      "dependencies": ["AUTHENTICATION", "DATABASE", "API"],
      "verification_required": true,
      "exception": {"applied": false, "reason": null}
    },
    {
      "module_id": "DATABASE",
      "required": false,
      "status": "NOT_REQUIRED",
      "business_reason": "Durable application state only when the product creates or mutates records.",
      "data_classes": ["application_data"],
      "security_risk": "HIGH",
      "external_provider": null,
      "owner": "application",
      "dependencies": [],
      "verification_required": true,
      "exception": {"applied": false, "reason": null}
    },
    {
      "module_id": "API",
      "required": false,
      "status": "NOT_REQUIRED",
      "business_reason": "Server boundary for application mutations and protected reads.",
      "data_classes": ["application_data"],
      "security_risk": "HIGH",
      "external_provider": null,
      "owner": "application",
      "dependencies": ["DATABASE"],
      "verification_required": true,
      "exception": {"applied": false, "reason": null}
    },
    {
      "module_id": "CATALOG",
      "required": false,
      "status": "NOT_REQUIRED",
      "business_reason": "Canonical products, variants, availability, and prices for commerce.",
      "data_classes": ["catalog", "pricing"],
      "security_risk": "HIGH",
      "external_provider": null,
      "owner": "application",
      "dependencies": ["DATABASE", "API"],
      "verification_required": true,
      "exception": {"applied": false, "reason": null}
    },
    {
      "module_id": "CART",
      "required": false,
      "status": "NOT_REQUIRED",
      "business_reason": "Server-authoritative cart state when multiple purchasable items are possible.",
      "data_classes": ["cart", "pricing"],
      "security_risk": "HIGH",
      "external_provider": null,
      "owner": "application",
      "dependencies": ["CATALOG", "DATABASE", "API"],
      "verification_required": true,
      "exception": {"applied": false, "reason": null}
    },
    {
      "module_id": "CHECKOUT",
      "required": false,
      "status": "NOT_REQUIRED",
      "business_reason": "Order review and confirmation flow when the user purchases.",
      "data_classes": ["order", "address"],
      "security_risk": "HIGH",
      "external_provider": null,
      "owner": "application",
      "dependencies": ["CART", "PAYMENT", "ORDER_MANAGEMENT"],
      "verification_required": true,
      "exception": {"applied": false, "reason": null}
    },
    {
      "module_id": "PAYMENT",
      "required": false,
      "status": "NOT_REQUIRED",
      "business_reason": "Payment authorization and confirmation only when a purchase is required.",
      "data_classes": ["payment_metadata"],
      "security_risk": "CRITICAL",
      "external_provider": null,
      "owner": "application",
      "dependencies": ["API", "WEBHOOKS"],
      "verification_required": true,
      "exception": {"applied": false, "reason": null}
    },
    {
      "module_id": "ORDER_MANAGEMENT",
      "required": false,
      "status": "NOT_REQUIRED",
      "business_reason": "Order lifecycle, fulfillment, cancellation, and refund state.",
      "data_classes": ["order", "fulfillment"],
      "security_risk": "HIGH",
      "external_provider": null,
      "owner": "application",
      "dependencies": ["DATABASE", "API"],
      "verification_required": true,
      "exception": {"applied": false, "reason": null}
    },
    {
      "module_id": "SUBSCRIPTION",
      "required": false,
      "status": "NOT_REQUIRED",
      "business_reason": "Recurring billing lifecycle only when the business model requires it.",
      "data_classes": ["subscription", "payment_metadata"],
      "security_risk": "CRITICAL",
      "external_provider": null,
      "owner": "application",
      "dependencies": ["PAYMENT", "ENTITLEMENT", "WEBHOOKS"],
      "verification_required": true,
      "exception": {"applied": false, "reason": null}
    },
    {
      "module_id": "BOOKING",
      "required": false,
      "status": "NOT_REQUIRED",
      "business_reason": "Availability, reservation, timezone, and conflict handling when appointments are booked.",
      "data_classes": ["booking", "calendar"],
      "security_risk": "HIGH",
      "external_provider": null,
      "owner": "application",
      "dependencies": ["DATABASE", "API"],
      "verification_required": true,
      "exception": {"applied": false, "reason": null}
    },
    {
      "module_id": "MEMBERSHIP",
      "required": false,
      "status": "NOT_REQUIRED",
      "business_reason": "Membership eligibility and access when the product promises member-only behavior.",
      "data_classes": ["membership", "identity"],
      "security_risk": "HIGH",
      "external_provider": null,
      "owner": "application",
      "dependencies": ["AUTHENTICATION", "AUTHORIZATION", "DATABASE"],
      "verification_required": true,
      "exception": {"applied": false, "reason": null}
    },
    {
      "module_id": "USER_GENERATED_CONTENT",
      "required": false,
      "status": "NOT_REQUIRED",
      "business_reason": "User-authored content only when the product accepts and displays it.",
      "data_classes": ["user_content", "personal_data"],
      "security_risk": "HIGH",
      "external_provider": null,
      "owner": "application",
      "dependencies": ["AUTHENTICATION", "AUTHORIZATION", "DATABASE", "API"],
      "verification_required": true,
      "exception": {"applied": false, "reason": null}
    },
    {
      "module_id": "FILE_UPLOAD",
      "required": false,
      "status": "NOT_REQUIRED",
      "business_reason": "File intake only when a user story requires files or media from users.",
      "data_classes": ["user_files"],
      "security_risk": "CRITICAL",
      "external_provider": null,
      "owner": "application",
      "dependencies": ["AUTHENTICATION", "AUTHORIZATION", "STORAGE"],
      "verification_required": true,
      "exception": {"applied": false, "reason": null}
    },
    {
      "module_id": "TRANSACTIONAL_EMAIL",
      "required": false,
      "status": "NOT_REQUIRED",
      "business_reason": "Required account, order, booking, or recovery messages only when the flow needs them.",
      "data_classes": ["email_address", "transactional_content"],
      "security_risk": "MEDIUM",
      "external_provider": null,
      "owner": "application",
      "dependencies": ["API"],
      "verification_required": true,
      "exception": {"applied": false, "reason": null}
    },
    {
      "module_id": "NOTIFICATIONS",
      "required": false,
      "status": "NOT_REQUIRED",
      "business_reason": "In-product or push notifications only when users need asynchronous status updates.",
      "data_classes": ["notification_content"],
      "security_risk": "MEDIUM",
      "external_provider": null,
      "owner": "application",
      "dependencies": ["AUTHENTICATION", "API"],
      "verification_required": true,
      "exception": {"applied": false, "reason": null}
    },
    {
      "module_id": "WEBHOOKS",
      "required": false,
      "status": "NOT_REQUIRED",
      "business_reason": "Signed provider event intake when external state changes must be reconciled.",
      "data_classes": ["provider_events", "payment_metadata"],
      "security_risk": "CRITICAL",
      "external_provider": null,
      "owner": "application",
      "dependencies": ["API", "DATABASE"],
      "verification_required": true,
      "exception": {"applied": false, "reason": null}
    },
    {
      "module_id": "SEARCH",
      "required": false,
      "status": "NOT_REQUIRED",
      "business_reason": "Search and filtering only when the content or catalog requires it.",
      "data_classes": ["search_queries", "catalog"],
      "security_risk": "MEDIUM",
      "external_provider": null,
      "owner": "application",
      "dependencies": ["API"],
      "verification_required": true,
      "exception": {"applied": false, "reason": null}
    },
    {
      "module_id": "BACKGROUND_JOBS",
      "required": false,
      "status": "NOT_REQUIRED",
      "business_reason": "Retryable asynchronous work only when a synchronous request cannot safely complete it.",
      "data_classes": ["job_payloads"],
      "security_risk": "HIGH",
      "external_provider": null,